{"id":"src_Bb1Bb1Bb1Bb1Bb1Bb1","session_id":"ses_Aa0Aa0Aa0Aa0Aa0Aa0","sha256":"aaaaaaaaaaaaaaaaaaaaaaaaaaaaaaaaaaaaaaaaaaaaaaaaaaaaaaaaaaaaaaaa","size_bytes":8388608,"display_name":"ensayo-sintetico.mp4","container":"mp4","video_codec":"h264","width":1280,"height":720,"duration_ms":45000,"time_base":"1/90000","video_stream_count":1,"other_streams":[],"received_at":"2026-10-19T15:00:00Z","capture_time":null,"capture_time_provenance":"unknown","authorization_acknowledged":true}
